{
  "pack_id": "class7-science-v1",
  "version": "1.0.0",
  "meta": {
    "class": 7,
    "board": "CBSE/BSE-Odisha",
    "subject": "science",
    "source": "NCERT Class 7 Science Chapter 1 — Nutrition in Plants (adapted for SATHI demo)"
  },
  "topics": [
    {
      "topic_id": "parts_of_plant",
      "chapter": "Nutrition in Plants",
      "difficulty": 1,
      "prerequisites": [],
      "aliases": {
        "en": ["parts of a plant", "plant parts", "parts of plant", "plant structure"],
        "hi": ["पौधे के भाग", "पौधे की संरचना", "पौधे के हिस्से"],
        "or": ["ଉଦ୍ଭିଦ ଅଂଶ", "ଗଛର ଅଂଶ", "ଉଦ୍ଭିଦ ଭାଗ"]
      },
      "concepts": [
        {
          "concept_id": "plant_organs",
          "content": {
            "en": "A plant has several main parts: roots, stem, leaves, flowers, and fruits. Roots anchor the plant in the soil and absorb water and minerals. The stem carries water and food between roots and leaves. Leaves are the main sites where food is made using sunlight. Flowers help in reproduction, and fruits protect the seeds.",
            "hi": "एक पौधे में कई मुख्य भाग होते हैं: जड़, तना, पत्तियाँ, फूल और फल। जड़ें पौधे को मिट्टी में स्थिर रखती हैं और पानी व खनिज अवशोषित करती हैं। तना जड़ों और पत्तियों के बीच पानी और भोजन पहुँचाता है। पत्तियाँ वह मुख्य स्थान हैं जहाँ सूर्य के प्रकाश का उपयोग करके भोजन बनाया जाता है। फूल प्रजनन में मदद करते हैं और फल बीजों की रक्षा करते हैं।",
            "or": "ଏକ ଉଦ୍ଭିଦ ର ଅନେକ ମୁଖ୍ୟ ଅଂଶ ଅଛି: ମୂଳ, ଡାଳ, ପତ୍ର, ଫୁଲ ଏବଂ ଫଳ। ମୂଳ ଉଦ୍ଭିଦ କୁ ମାଟିରେ ଧରି ରଖେ ଏବଂ ପାଣି ଓ ଖଣିଜ ଶୋଷଣ କରେ। ଡାଳ ମୂଳ ଓ ପତ୍ର ମଧ୍ୟରେ ପାଣି ଓ ଖାଦ୍ୟ ପରିବହନ କରେ। ପତ୍ର ହେଉଛି ସୂର୍ଯ୍ୟ ଆଲୋକ ବ୍ୟବହାର କରି ଖାଦ୍ୟ ପ୍ରସ୍ତୁତ କରିବାର ମୁଖ୍ୟ ସ୍ଥାନ। ଫୁଲ ପ୍ରଜନନ ରେ ସାହାଯ୍ୟ କରେ ଏବଂ ଫଳ ବିଜ ରକ୍ଷା କରେ।"
          },
          "examples": {
            "en": [
              "The roots of a mango tree go deep into the ground to drink water, just like a straw.",
              "The stem of a banana plant is thick because it stores water for dry days.",
              "A leaf is like a solar panel — it faces the sun to catch as much light as possible."
            ],
            "hi": [
              "आम के पेड़ की जड़ें पानी पीने के लिए गहरी जमीन में जाती हैं, जैसे स्ट्रॉ से पानी पीते हैं।",
              "केले के पेड़ का तना मोटा होता है क्योंकि वह सूखे दिनों के लिए पानी जमा करता है।",
              "एक पत्ती सौर पैनल की तरह है — वह अधिक से अधिक प्रकाश पाने के लिए सूरज की ओर मुड़ती है।"
            ],
            "or": [
              "ଆମ ଗଛ ର ମୂଳ ପାଣି ପିଇବାକୁ ଗଭୀର ମାଟିକୁ ଯାଏ, ଯେପରି ଷ୍ଟ୍ରରୁ ପାଣି ପିଇଥୁ।",
              "କଦଳୀ ଗଛ ର ଡାଳ ମୋଟ ହୁଏ କାରଣ ଏହା ଶୁଖିଲା ଦିନ ପାଇଁ ପାଣି ଜମା ରଖେ।",
              "ପତ୍ର ଏକ ସୋଲାର ପ୍ୟାନେଲ ପରି — ଏହା ଅଧିକ ଆଲୋକ ପାଇଁ ସୂର୍ଯ୍ୟ ଆଡ଼କୁ ମୁହଁ କରେ।"
            ]
          }
        }
      ],
      "misconceptions": [
        {
          "id": "roots_make_food",
          "description": {
            "en": "Roots make food for the plant",
            "hi": "जड़ें पौधे के लिए भोजन बनाती हैं",
            "or": "ମୂଳ ଉଦ୍ଭିଦ ପାଇଁ ଖାଦ୍ୟ ତିଆରି କରେ"
          },
          "remediation_example": {
            "en": "Roots only absorb water and minerals from the soil — they do not make food. Food is made in the green leaves using sunlight. If you cover a plant's leaves completely for a week, the plant will starve even though its roots still have soil.",
            "hi": "जड़ें केवल मिट्टी से पानी और खनिज अवशोषित करती हैं — वे भोजन नहीं बनातीं। भोजन हरी पत्तियों में सूर्य के प्रकाश का उपयोग करके बनाया जाता है। यदि आप एक सप्ताह के लिए पौधे की पत्तियों को पूरी तरह ढक दें, तो पौधा भूखा रह जाएगा, भले ही उसकी जड़ों के पास अभी भी मिट्टी हो।",
            "or": "ମୂଳ କେବଳ ମାଟିରୁ ପାଣି ଓ ଖଣିଜ ଶୋଷଣ କରେ — ଏହା ଖାଦ୍ୟ ତିଆରି କରେ ନାହିଁ। ଖାଦ୍ୟ ସୂର୍ଯ୍ୟ ଆଲୋକ ବ୍ୟବହାର କରି ସବୁଜ ପତ୍ରରେ ତିଆରି ହୁଏ। ଯଦି ଆପଣ ଏକ ସପ୍ତାହ ପାଇଁ ଉଦ୍ଭିଦ ର ପତ୍ର ସମ୍ପୂର୍ଣ ଭାବେ ଢାଙ୍କି ଦିଅନ୍ତି, ଉଦ୍ଭିଦ ଟି ଭୋକ ଲାଗିବ ଯଦିଓ ଏହାର ମୂଳ ରେ ଏଖନ ମଧ୍ୟ ମାଟି ଅଛି।"
          }
        }
      ],
      "quiz": [
        {
          "question_id": "pop_q1",
          "difficulty": "easy",
          "type": "mcq",
          "concept_id": "plant_organs",
          "stem": {
            "en": "Which part of a plant absorbs water from the soil?",
            "hi": "पौधे का कौन सा भाग मिट्टी से पानी अवशोषित करता है?",
            "or": "ଉଦ୍ଭିଦ ର କେଉଁ ଅଂଶ ମାଟିରୁ ପାଣି ଶୋଷଣ କରେ?"
          },
          "options": [
            {
              "id": "a",
              "text": {
                "en": "Roots",
                "hi": "जड़ें",
                "or": "ମୂଳ"
              },
              "correct": true
            },
            {
              "id": "b",
              "text": {
                "en": "Leaves",
                "hi": "पत्तियाँ",
                "or": "ପତ୍ର"
              },
              "misconception_id": "roots_make_food"
            },
            {
              "id": "c",
              "text": {
                "en": "Flowers",
                "hi": "फूल",
                "or": "ଫୁଲ"
              },
              "misconception_id": null
            },
            {
              "id": "d",
              "text": {
                "en": "Fruits",
                "hi": "फल",
                "or": "ଫଳ"
              },
              "misconception_id": null
            }
          ]
        },
        {
          "question_id": "pop_q2",
          "difficulty": "easy",
          "type": "mcq",
          "concept_id": "plant_organs",
          "stem": {
            "en": "Where is food made in a plant?",
            "hi": "पौधे में भोजन कहाँ बनाया जाता है?",
            "or": "ଉଦ୍ଭିଦ ରେ ଖାଦ୍ୟ କେଉଁଠି ତିଆରି ହୁଏ?"
          },
          "options": [
            {
              "id": "a",
              "text": {
                "en": "In the leaves, using sunlight",
                "hi": "पत्तियों में, सूर्य के प्रकाश का उपयोग करके",
                "or": "ପତ୍ରରେ, ସୂର୍ଯ୍ୟ ଆଲୋକ ବ୍ୟବହାର କରି"
              },
              "correct": true
            },
            {
              "id": "b",
              "text": {
                "en": "In the roots, from the soil",
                "hi": "जड़ों में, मिट्टी से",
                "or": "ମୂଳ ରେ, ମାଟିରୁ"
              },
              "misconception_id": "roots_make_food"
            },
            {
              "id": "c",
              "text": {
                "en": "In the flowers, during blooming",
                "hi": "फूलों में, खिलने के दौरान",
                "or": "ଫୁଲ ରେ, ଫୁଟିବା ସମୟ ରେ"
              },
              "misconception_id": null
            },
            {
              "id": "d",
              "text": {
                "en": "In the stem, from water",
                "hi": "तने में, पानी से",
                "or": "ଡାଳ ରେ, ପାଣିରୁ"
              },
              "misconception_id": null
            }
          ]
        },
        {
          "question_id": "pop_q3",
          "difficulty": "medium",
          "type": "mcq",
          "concept_id": "plant_organs",
          "stem": {
            "en": "What is the main job of the stem in a plant?",
            "hi": "पौधे में तने का मुख्य काम क्या है?",
            "or": "ଉଦ୍ଭିଦ ରେ ଡାଳ ର ମୁଖ୍ୟ କାମ କଣ?"
          },
          "options": [
            {
              "id": "a",
              "text": {
                "en": "To carry water and food between roots and leaves",
                "hi": "जड़ों और पत्तियों के बीच पानी और भोजन पहुँचाना",
                "or": "ମୂଳ ଓ ପତ୍ର ମଧ୍ୟ ରେ ପାଣି ଓ ଖାଦ୍ୟ ବହନ କରିବା"
              },
              "correct": true
            },
            {
              "id": "b",
              "text": {
                "en": "To absorb sunlight directly",
                "hi": "सीधे सूर्य का प्रकाश अवशोषित करना",
                "or": "ସିଧାସଳଖ ସୂର୍ଯ୍ୟ ଆଲୋକ ଶୋଷଣ କରିବା"
              },
              "misconception_id": null
            },
            {
              "id": "c",
              "text": {
                "en": "To store seeds for reproduction",
                "hi": "प्रजनन के लिए बीज संग्रहीत करना",
                "or": "ପ୍ରଜନନ ପାଇଁ ବିଜ ସଂଗ୍ରହ କରିବା"
              },
              "misconception_id": null
            },
            {
              "id": "d",
              "text": {
                "en": "To make oxygen from carbon dioxide",
                "hi": "कार्बन डाइऑक्साइड से ऑक्सीजन बनाना",
                "or": "କାର୍ବନ ଡାଇଅକ୍ସାଇଡ ରୁ ଅକ୍ସିଜେନ ତିଆରି କରିବା"
              },
              "misconception_id": null
            }
          ]
        }
      ]
    },
    {
      "topic_id": "photosynthesis",
      "chapter": "Nutrition in Plants",
      "difficulty": 2,
      "prerequisites": ["parts_of_plant"],
      "aliases": {
        "en": ["photosynthesis", "photo synthesis", "how plants make food", "plant food making", "food synthesis in plants"],
        "hi": ["प्रकाश संश्लेषण", "प्रकाश-संश्लेषण", "पौधे भोजन कैसे बनाते हैं", "पत्तियों में भोजन"],
        "or": ["ଆଲୋକ ସଂଶ୍ଳେଷଣ", "ଉଦ୍ଭିଦ ଖାଦ୍ୟ ତିଆରି", "ପ୍ରକାଶ ସଂଶ୍ଳେଷଣ", "ଗଛ ଖାଦ୍ୟ"]
      },
      "concepts": [
        {
          "concept_id": "plants_make_own_food",
          "content": {
            "en": "Green plants are special — they can make their own food using a process called photosynthesis (ଆଲୋକ ସଂଶ୍ଳେଷଣ / प्रकाश संश्लेषण). In this process, the green leaves capture sunlight using a green pigment called chlorophyll (ହରିତ ଲବ). The leaves take in carbon dioxide (CO₂) from the air through tiny pores called stomata, and roots supply water (H₂O) through the stem. Using sunlight energy, the leaf converts CO₂ and H₂O into glucose (sugar) for food and releases oxygen (O₂) as a by-product. This is why plants need sunlight, water, and air — not soil food.",